B1: Status | D1: Benefício | H1: Percentuais
B2: P | C2: A | D2: C | E2: I | F2: U | G2: D | H2: P | I2: A | J2: C | K2: I | L2: U | M2: D
A3: C1 | B3: 0 | C3: 10 | D3: 3 | E3: 4 | F3: 3 | G3: 0 | H3: =B3/SUM(B3:C3) -> 0 | I3: =C3/SUM(B3:C3) -> 1 | J3: =D3/SUM(D3:G3) -> 00.3 | K3: =E3/SUM(D3:G3) -> 00.4 | L3: =F3/SUM(D3:G3) -> 00.3 | M3: =G3/SUM(D3:G3) -> 0
A4: C1.1 | B4: 0 | C4: 10 | D4: 2 | E4: 5 | F4: 3 | G4: 0 | H4: =B4/SUM(B4:C4) -> 0 | I4: =C4/SUM(B4:C4) -> 1 | J4: =D4/SUM(D4:G4) -> 00.2 | K4: =E4/SUM(D4:G4) -> 0.5 | L4: =F4/SUM(D4:G4) -> 00.3 | M4: =G4/SUM(D4:G4) -> 0
A5: C1.2 | B5: 0 | C5: 10 | D5: 5 | E5: 4 | F5: 1 | G5: 0 | H5: =B5/SUM(B5:C5) -> 0 | I5: =C5/SUM(B5:C5) -> 1 | J5: =D5/SUM(D5:G5) -> 0.5 | K5: =E5/SUM(D5:G5) -> 00.4 | L5: =F5/SUM(D5:G5) -> 00.1 | M5: =G5/SUM(D5:G5) -> 0
A6: C2 | B6: 3 | C6: 7 | D6: 5 | E6: 1 | F6: 4 | G6: 0 | H6: =B6/SUM(B6:C6) -> 00.3 | I6: =C6/SUM(B6:C6) -> 00.7 | J6: =D6/SUM(D6:G6) -> 0.5 | K6: =E6/SUM(D6:G6) -> 00.1 | L6: =F6/SUM(D6:G6) -> 00.4 | M6: =G6/SUM(D6:G6) -> 0
A7: C3 | B7: 3 | C7: 7 | D7: 2 | E7: 5 | F7: 2 | G7: 1 | H7: =B7/SUM(B7:C7) -> 00.3 | I7: =C7/SUM(B7:C7) -> 00.7 | J7: =D7/SUM(D7:G7) -> 00.2 | K7: =E7/SUM(D7:G7) -> 0.5 | L7: =F7/SUM(D7:G7) -> 00.2 | M7: =G7/SUM(D7:G7) -> 00.1
A8: C4 | B8: 5 | C8: 5 | D8: 3 | E8: 1 | F8: 6 | G8: 0 | H8: =B8/SUM(B8:C8) -> 0.5 | I8: =C8/SUM(B8:C8) -> 0.5 | J8: =D8/SUM(D8:G8) -> 00.3 | K8: =E8/SUM(D8:G8) -> 00.1 | L8: =F8/SUM(D8:G8) -> 00.6 | M8: =G8/SUM(D8:G8) -> 0
A9: C4.1 | B9: 1 | C9: 9 | D9: 5 | E9: 3 | F9: 2 | G9: 0 | H9: =B9/SUM(B9:C9) -> 00.1 | I9: =C9/SUM(B9:C9) -> 00.9 | J9: =D9/SUM(D9:G9) -> 0.5 | K9: =E9/SUM(D9:G9) -> 00.3 | L9: =F9/SUM(D9:G9) -> 00.2 | M9: =G9/SUM(D9:G9) -> 0
A10: C4.2 | B10: 0 | C10: 10 | D10: 7 | E10: 2 | F10: 1 | G10: 0 | H10: =B10/SUM(B10:C10) -> 0 | I10: =C10/SUM(B10:C10) -> 1 | J10: =D10/SUM(D10:G10) -> 00.7 | K10: =E10/SUM(D10:G10) -> 00.2 | L10: =F10/SUM(D10:G10) -> 00.1 | M10: =G10/SUM(D10:G10) -> 0
A11: C5 | B11: 4 | C11: 6 | D11: 3 | E11: 1 | F11: 6 | G11: 0 | H11: =B11/SUM(B11:C11) -> 00.4 | I11: =C11/SUM(B11:C11) -> 00.6 | J11: =D11/SUM(D11:G11) -> 00.3 | K11: =E11/SUM(D11:G11) -> 00.1 | L11: =F11/SUM(D11:G11) -> 00.6 | M11: =G11/SUM(D11:G11) -> 0
A12: C5.1 | B12: 4 | C12: 6 | D12: 1 | E12: 4 | F12: 4 | G12: 1 | H12: =B12/SUM(B12:C12) -> 00.4 | I12: =C12/SUM(B12:C12) -> 00.6 | J12: =D12/SUM(D12:G12) -> 00.1 | K12: =E12/SUM(D12:G12) -> 00.4 | L12: =F12/SUM(D12:G12) -> 00.4 | M12: =G12/SUM(D12:G12) -> 00.1
A13: C5.2 | B13: 0 | C13: 10 | D13: 4 | E13: 4 | F13: 2 | G13: 0 | H13: =B13/SUM(B13:C13) -> 0 | I13: =C13/SUM(B13:C13) -> 1 | J13: =D13/SUM(D13:G13) -> 00.4 | K13: =E13/SUM(D13:G13) -> 00.4 | L13: =F13/SUM(D13:G13) -> 00.2 | M13: =G13/SUM(D13:G13) -> 0
A14: C6 | B14: 1 | C14: 9 | D14: 4 | E14: 1 | F14: 5 | G14: 0 | H14: =B14/SUM(B14:C14) -> 00.1 | I14: =C14/SUM(B14:C14) -> 00.9 | J14: =D14/SUM(D14:G14) -> 00.4 | K14: =E14/SUM(D14:G14) -> 00.1 | L14: =F14/SUM(D14:G14) -> 0.5 | M14: =G14/SUM(D14:G14) -> 0
A15: C7 | B15: 4 | C15: 6 | D15: 8 | E15: 0 | F15: 2 | G15: 0 | H15: =B15/SUM(B15:C15) -> 00.4 | I15: =C15/SUM(B15:C15) -> 00.6 | J15: =D15/SUM(D15:G15) -> 00.8 | K15: =E15/SUM(D15:G15) -> 0 | L15: =F15/SUM(D15:G15) -> 00.2 | M15: =G15/SUM(D15:G15) -> 0
A16: C7.1 | B16: 3 | C16: 7 | D16: 4 | E16: 2 | F16: 4 | G16: 0 | H16: =B16/SUM(B16:C16) -> 00.3 | I16: =C16/SUM(B16:C16) -> 00.7 | J16: =D16/SUM(D16:G16) -> 00.4 | K16: =E16/SUM(D16:G16) -> 00.2 | L16: =F16/SUM(D16:G16) -> 00.4 | M16: =G16/SUM(D16:G16) -> 0
A17: C7.2 | B17: 3 | C17: 7 | D17: 4 | E17: 2 | F17: 4 | G17: 0 | H17: =B17/SUM(B17:C17) -> 00.3 | I17: =C17/SUM(B17:C17) -> 00.7 | J17: =D17/SUM(D17:G17) -> 00.4 | K17: =E17/SUM(D17:G17) -> 00.2 | L17: =F17/SUM(D17:G17) -> 00.4 | M17: =G17/SUM(D17:G17) -> 0
A18: C7.3 | B18: 1 | C18: 9 | D18: 5 | E18: 1 | F18: 4 | G18: 0 | H18: =B18/SUM(B18:C18) -> 00.1 | I18: =C18/SUM(B18:C18) -> 00.9 | J18: =D18/SUM(D18:G18) -> 0.5 | K18: =E18/SUM(D18:G18) -> 00.1 | L18: =F18/SUM(D18:G18) -> 00.4 | M18: =G18/SUM(D18:G18) -> 0
A19: C7.4 | B19: 2 | C19: 8 | D19: 4 | E19: 3 | F19: 3 | G19: 0 | H19: =B19/SUM(B19:C19) -> 00.2 | I19: =C19/SUM(B19:C19) -> 00.8 | J19: =D19/SUM(D19:G19) -> 00.4 | K19: =E19/SUM(D19:G19) -> 00.3 | L19: =F19/SUM(D19:G19) -> 00.3 | M19: =G19/SUM(D19:G19) -> 0
A20: C7.5 | B20: 3 | C20: 7 | D20: 5 | E20: 1 | F20: 3 | G20: 1 | H20: =B20/SUM(B20:C20) -> 00.3 | I20: =C20/SUM(B20:C20) -> 00.7 | J20: =D20/SUM(D20:G20) -> 0.5 | K20: =E20/SUM(D20:G20) -> 00.1 | L20: =F20/SUM(D20:G20) -> 00.3 | M20: =G20/SUM(D20:G20) -> 00.1
A21: C8 | B21: 2 | C21: 8 | D21: 2 | E21: 5 | F21: 3 | G21: 0 | H21: =B21/SUM(B21:C21) -> 00.2 | I21: =C21/SUM(B21:C21) -> 00.8 | J21: =D21/SUM(D21:G21) -> 00.2 | K21: =E21/SUM(D21:G21) -> 0.5 | L21: =F21/SUM(D21:G21) -> 00.3 | M21: =G21/SUM(D21:G21) -> 0
A22: C9 | B22: 3 | C22: 7 | D22: 1 | E22: 6 | F22: 3 | G22: 0 | H22: =B22/SUM(B22:C22) -> 00.3 | I22: =C22/SUM(B22:C22) -> 00.7 | J22: =D22/SUM(D22:G22) -> 00.1 | K22: =E22/SUM(D22:G22) -> 00.6 | L22: =F22/SUM(D22:G22) -> 00.3 | M22: =G22/SUM(D22:G22) -> 0
A23: C10 | B23: 2 | C23: 8 | D23: 4 | E23: 4 | F23: 2 | G23: 0 | H23: =B23/SUM(B23:C23) -> 00.2 | I23: =C23/SUM(B23:C23) -> 00.8 | J23: =D23/SUM(D23:G23) -> 00.4 | K23: =E23/SUM(D23:G23) -> 00.4 | L23: =F23/SUM(D23:G23) -> 00.2 | M23: =G23/SUM(D23:G23) -> 0
A24: C11 | B24: 2 | C24: 8 | D24: 3 | E24: 4 | F24: 3 | G24: 0 | H24: =B24/SUM(B24:C24) -> 00.2 | I24: =C24/SUM(B24:C24) -> 00.8 | J24: =D24/SUM(D24:G24) -> 00.3 | K24: =E24/SUM(D24:G24) -> 00.4 | L24: =F24/SUM(D24:G24) -> 00.3 | M24: =G24/SUM(D24:G24) -> 0
A25: C12 | B25: 6 | C25: 4 | D25: 2 | E25: 3 | F25: 5 | G25: 0 | H25: =B25/SUM(B25:C25) -> 00.6 | I25: =C25/SUM(B25:C25) -> 00.4 | J25: =D25/SUM(D25:G25) -> 00.2 | K25: =E25/SUM(D25:G25) -> 00.3 | L25: =F25/SUM(D25:G25) -> 0.5 | M25: =G25/SUM(D25:G25) -> 0
A26: C12.1 | B26: 2 | C26: 8 | D26: 2 | E26: 3 | F26: 3 | G26: 2 | H26: =B26/SUM(B26:C26) -> 00.2 | I26: =C26/SUM(B26:C26) -> 00.8 | J26: =D26/SUM(D26:G26) -> 00.2 | K26: =E26/SUM(D26:G26) -> 00.3 | L26: =F26/SUM(D26:G26) -> 00.3 | M26: =G26/SUM(D26:G26) -> 00.2
A27: C12.2 | B27: 4 | C27: 6 | D27: 2 | E27: 3 | F27: 3 | G27: 2 | H27: =B27/SUM(B27:C27) -> 00.4 | I27: =C27/SUM(B27:C27) -> 00.6 | J27: =D27/SUM(D27:G27) -> 00.2 | K27: =E27/SUM(D27:G27) -> 00.3 | L27: =F27/SUM(D27:G27) -> 00.3 | M27: =G27/SUM(D27:G27) -> 00.2
A28: C12.3 | B28: 5 | C28: 5 | D28: 1 | E28: 3 | F28: 4 | G28: 2 | H28: =B28/SUM(B28:C28) -> 0.5 | I28: =C28/SUM(B28:C28) -> 0.5 | J28: =D28/SUM(D28:G28) -> 00.1 | K28: =E28/SUM(D28:G28) -> 00.3 | L28: =F28/SUM(D28:G28) -> 00.4 | M28: =G28/SUM(D28:G28) -> 00.2
A29: C13 | B29: 3 | C29: 7 | D29: 2 | E29: 4 | F29: 3 | G29: 1 | H29: =B29/SUM(B29:C29) -> 00.3 | I29: =C29/SUM(B29:C29) -> 00.7 | J29: =D29/SUM(D29:G29) -> 00.2 | K29: =E29/SUM(D29:G29) -> 00.4 | L29: =F29/SUM(D29:G29) -> 00.3 | M29: =G29/SUM(D29:G29) -> 00.1
A30: C14 | B30: 2 | C30: 8 | D30: 2 | E30: 2 | F30: 4 | G30: 2 | H30: =B30/SUM(B30:C30) -> 00.2 | I30: =C30/SUM(B30:C30) -> 00.8 | J30: =D30/SUM(D30:G30) -> 00.2 | K30: =E30/SUM(D30:G30) -> 00.2 | L30: =F30/SUM(D30:G30) -> 00.4 | M30: =G30/SUM(D30:G30) -> 00.2
A31: C14.1 | B31: 0 | C31: 10 | D31: 3 | E31: 6 | F31: 1 | G31: 0 | H31: =B31/SUM(B31:C31) -> 0 | I31: =C31/SUM(B31:C31) -> 1 | J31: =D31/SUM(D31:G31) -> 00.3 | K31: =E31/SUM(D31:G31) -> 00.6 | L31: =F31/SUM(D31:G31) -> 00.1 | M31: =G31/SUM(D31:G31) -> 0
A32: C14.2 | B32: 1 | C32: 9 | D32: 4 | E32: 4 | F32: 1 | G32: 1 | H32: =B32/SUM(B32:C32) -> 00.1 | I32: =C32/SUM(B32:C32) -> 00.9 | J32: =D32/SUM(D32:G32) -> 00.4 | K32: =E32/SUM(D32:G32) -> 00.4 | L32: =F32/SUM(D32:G32) -> 00.1 | M32: =G32/SUM(D32:G32) -> 00.1
A33: C14.3 | B33: 1 | C33: 9 | D33: 4 | E33: 5 | F33: 1 | G33: 0 | H33: =B33/SUM(B33:C33) -> 00.1 | I33: =C33/SUM(B33:C33) -> 00.9 | J33: =D33/SUM(D33:G33) -> 00.4 | K33: =E33/SUM(D33:G33) -> 0.5 | L33: =F33/SUM(D33:G33) -> 00.1 | M33: =G33/SUM(D33:G33) -> 0
A34: C14.4 | B34: 0 | C34: 10 | D34: 4 | E34: 4 | F34: 2 | G34: 0 | H34: =B34/SUM(B34:C34) -> 0 | I34: =C34/SUM(B34:C34) -> 1 | J34: =D34/SUM(D34:G34) -> 00.4 | K34: =E34/SUM(D34:G34) -> 00.4 | L34: =F34/SUM(D34:G34) -> 00.2 | M34: =G34/SUM(D34:G34) -> 0
A35: C15 | B35: 0 | C35: 10 | D35: 7 | E35: 2 | F35: 1 | G35: 0 | H35: =B35/SUM(B35:C35) -> 0 | I35: =C35/SUM(B35:C35) -> 1 | J35: =D35/SUM(D35:G35) -> 00.7 | K35: =E35/SUM(D35:G35) -> 00.2 | L35: =F35/SUM(D35:G35) -> 00.1 | M35: =G35/SUM(D35:G35) -> 0
A36: C16 | B36: 1 | C36: 9 | D36: 5 | E36: 4 | F36: 1 | G36: 0 | H36: =B36/SUM(B36:C36) -> 00.1 | I36: =C36/SUM(B36:C36) -> 00.9 | J36: =D36/SUM(D36:G36) -> 0.5 | K36: =E36/SUM(D36:G36) -> 00.4 | L36: =F36/SUM(D36:G36) -> 00.1 | M36: =G36/SUM(D36:G36) -> 0
A37: C17 | B37: 0 | C37: 10 | D37: 8 | E37: 1 | F37: 1 | G37: 0 | H37: =B37/SUM(B37:C37) -> 0 | I37: =C37/SUM(B37:C37) -> 1 | J37: =D37/SUM(D37:G37) -> 00.8 | K37: =E37/SUM(D37:G37) -> 00.1 | L37: =F37/SUM(D37:G37) -> 00.1 | M37: =G37/SUM(D37:G37) -> 0
A38: C17.1 | B38: 1 | C38: 9 | D38: 6 | E38: 3 | F38: 1 | G38: 0 | H38: =B38/SUM(B38:C38) -> 00.1 | I38: =C38/SUM(B38:C38) -> 00.9 | J38: =D38/SUM(D38:G38) -> 00.6 | K38: =E38/SUM(D38:G38) -> 00.3 | L38: =F38/SUM(D38:G38) -> 00.1 | M38: =G38/SUM(D38:G38) -> 0
A39: C17.2 | B39: 1 | C39: 9 | D39: 4 | E39: 5 | F39: 1 | G39: 0 | H39: =B39/SUM(B39:C39) -> 00.1 | I39: =C39/SUM(B39:C39) -> 00.9 | J39: =D39/SUM(D39:G39) -> 00.4 | K39: =E39/SUM(D39:G39) -> 0.5 | L39: =F39/SUM(D39:G39) -> 00.1 | M39: =G39/SUM(D39:G39) -> 0
A40: C17.3 | B40: 0 | C40: 10 | D40: 6 | E40: 3 | F40: 1 | G40: 0 | H40: =B40/SUM(B40:C40) -> 0 | I40: =C40/SUM(B40:C40) -> 1 | J40: =D40/SUM(D40:G40) -> 00.6 | K40: =E40/SUM(D40:G40) -> 00.3 | L40: =F40/SUM(D40:G40) -> 00.1 | M40: =G40/SUM(D40:G40) -> 0
A41: C17.4 | B41: 0 | C41: 10 | D41: 6 | E41: 3 | F41: 1 | G41: 0 | H41: =B41/SUM(B41:C41) -> 0 | I41: =C41/SUM(B41:C41) -> 1 | J41: =D41/SUM(D41:G41) -> 00.6 | K41: =E41/SUM(D41:G41) -> 00.3 | L41: =F41/SUM(D41:G41) -> 00.1 | M41: =G41/SUM(D41:G41) -> 0
A42: C17.5 | B42: 0 | C42: 10 | D42: 4 | E42: 4 | F42: 2 | G42: 0 | H42: =B42/SUM(B42:C42) -> 0 | I42: =C42/SUM(B42:C42) -> 1 | J42: =D42/SUM(D42:G42) -> 00.4 | K42: =E42/SUM(D42:G42) -> 00.4 | L42: =F42/SUM(D42:G42) -> 00.2 | M42: =G42/SUM(D42:G42) -> 0
A43: C17.6 | B43: 0 | C43: 10 | D43: 5 | E43: 3 | F43: 2 | G43: 0 | H43: =B43/SUM(B43:C43) -> 0 | I43: =C43/SUM(B43:C43) -> 1 | J43: =D43/SUM(D43:G43) -> 0.5 | K43: =E43/SUM(D43:G43) -> 00.3 | L43: =F43/SUM(D43:G43) -> 00.2 | M43: =G43/SUM(D43:G43) -> 0
A44: C17.7 | B44: 1 | C44: 9 | D44: 3 | E44: 5 | F44: 2 | G44: 0 | H44: =B44/SUM(B44:C44) -> 00.1 | I44: =C44/SUM(B44:C44) -> 00.9 | J44: =D44/SUM(D44:G44) -> 00.3 | K44: =E44/SUM(D44:G44) -> 0.5 | L44: =F44/SUM(D44:G44) -> 00.2 | M44: =G44/SUM(D44:G44) -> 0
A45: C17.8 | B45: 3 | C45: 7 | D45: 2 | E45: 5 | F45: 1 | G45: 2 | H45: =B45/SUM(B45:C45) -> 00.3 | I45: =C45/SUM(B45:C45) -> 00.7 | J45: =D45/SUM(D45:G45) -> 00.2 | K45: =E45/SUM(D45:G45) -> 0.5 | L45: =F45/SUM(D45:G45) -> 00.1 | M45: =G45/SUM(D45:G45) -> 00.2
A46: C18 | B46: 4 | C46: 6 | D46: 4 | E46: 1 | F46: 5 | G46: 0 | H46: =B46/SUM(B46:C46) -> 00.4 | I46: =C46/SUM(B46:C46) -> 00.6 | J46: =D46/SUM(D46:G46) -> 00.4 | K46: =E46/SUM(D46:G46) -> 00.1 | L46: =F46/SUM(D46:G46) -> 0.5 | M46: =G46/SUM(D46:G46) -> 0
A47: C18.1 | B47: 2 | C47: 8 | D47: 5 | E47: 3 | F47: 2 | G47: 0 | H47: =B47/SUM(B47:C47) -> 00.2 | I47: =C47/SUM(B47:C47) -> 00.8 | J47: =D47/SUM(D47:G47) -> 0.5 | K47: =E47/SUM(D47:G47) -> 00.3 | L47: =F47/SUM(D47:G47) -> 00.2 | M47: =G47/SUM(D47:G47) -> 0
A48: C18.2 | B48: 0 | C48: 10 | D48: 6 | E48: 2 | F48: 2 | G48: 0 | H48: =B48/SUM(B48:C48) -> 0 | I48: =C48/SUM(B48:C48) -> 1 | J48: =D48/SUM(D48:G48) -> 00.6 | K48: =E48/SUM(D48:G48) -> 00.2 | L48: =F48/SUM(D48:G48) -> 00.2 | M48: =G48/SUM(D48:G48) -> 0
A49: C18.3 | B49: 1 | C49: 9 | D49: 6 | E49: 2 | F49: 2 | G49: 0 | H49: =B49/SUM(B49:C49) -> 00.1 | I49: =C49/SUM(B49:C49) -> 00.9 | J49: =D49/SUM(D49:G49) -> 00.6 | K49: =E49/SUM(D49:G49) -> 00.2 | L49: =F49/SUM(D49:G49) -> 00.2 | M49: =G49/SUM(D49:G49) -> 0
A50: C19 | B50: 1 | C50: 9 | D50: 3 | E50: 4 | F50: 2 | G50: 1 | H50: =B50/SUM(B50:C50) -> 00.1 | I50: =C50/SUM(B50:C50) -> 00.9 | J50: =D50/SUM(D50:G50) -> 00.3 | K50: =E50/SUM(D50:G50) -> 00.4 | L50: =F50/SUM(D50:G50) -> 00.2 | M50: =G50/SUM(D50:G50) -> 00.1
A51: C20 | B51: 1 | C51: 9 | D51: 3 | E51: 5 | F51: 1 | G51: 1 | H51: =B51/SUM(B51:C51) -> 00.1 | I51: =C51/SUM(B51:C51) -> 00.9 | J51: =D51/SUM(D51:G51) -> 00.3 | K51: =E51/SUM(D51:G51) -> 0.5 | L51: =F51/SUM(D51:G51) -> 00.1 | M51: =G51/SUM(D51:G51) -> 00.1
A52: C21 | B52: 1 | C52: 9 | D52: 6 | E52: 2 | F52: 1 | G52: 1 | H52: =B52/SUM(B52:C52) -> 00.1 | I52: =C52/SUM(B52:C52) -> 00.9 | J52: =D52/SUM(D52:G52) -> 00.6 | K52: =E52/SUM(D52:G52) -> 00.2 | L52: =F52/SUM(D52:G52) -> 00.1 | M52: =G52/SUM(D52:G52) -> 00.1
A53: TOTAIS | B53: =SUM(B3:B52) -> 87 | C53: =SUM(C3:C52) -> 413 | D53: =SUM(D3:D52) -> 199 | E53: =SUM(E3:E52) -> 157 | F53: =SUM(F3:F52) -> 126 | G53: =SUM(G3:G52) -> 18