B1: Status | D1: Benefício | H1: Percentuais
B2: P | C2: A | D2: C | E2: I | F2: U | G2: D | H2: P | I2: A | J2: C | K2: I | L2: U | M2: D
A3: S1 | B3: 3 | C3: 7 | D3: 5 | E3: 3 | F3: 1 | G3: 1 | H3: =B3/SUM(B3:C3) -> 00.3 | I3: =C3/SUM(B3:C3) -> 00.7 | J3: =D3/SUM(D3:G3) -> 0.5 | K3: =E3/SUM(D3:G3) -> 00.3 | L3: =F3/SUM(D3:G3) -> 00.1 | M3: =G3/SUM(D3:G3) -> 00.1
A4: S2 | B4: 2 | C4: 8 | D4: 3 | E4: 4 | F4: 2 | G4: 1 | H4: =B4/SUM(B4:C4) -> 00.2 | I4: =C4/SUM(B4:C4) -> 00.8 | J4: =D4/SUM(D4:G4) -> 00.3 | K4: =E4/SUM(D4:G4) -> 00.4 | L4: =F4/SUM(D4:G4) -> 00.2 | M4: =G4/SUM(D4:G4) -> 00.1
A5: S3 | B5: 5 | C5: 5 | D5: 1 | E5: 2 | F5: 2 | G5: 5 | H5: =B5/SUM(B5:C5) -> 0.5 | I5: =C5/SUM(B5:C5) -> 0.5 | J5: =D5/SUM(D5:G5) -> 00.1 | K5: =E5/SUM(D5:G5) -> 00.2 | L5: =F5/SUM(D5:G5) -> 00.2 | M5: =G5/SUM(D5:G5) -> 0.5
A6: S4 | B6: 1 | C6: 9 | D6: 5 | E6: 2 | F6: 1 | G6: 2 | H6: =B6/SUM(B6:C6) -> 00.1 | I6: =C6/SUM(B6:C6) -> 00.9 | J6: =D6/SUM(D6:G6) -> 0.5 | K6: =E6/SUM(D6:G6) -> 00.2 | L6: =F6/SUM(D6:G6) -> 00.1 | M6: =G6/SUM(D6:G6) -> 00.2
A7: S5 | B7: 4 | C7: 6 | D7: 3 | E7: 5 | F7: 1 | G7: 1 | H7: =B7/SUM(B7:C7) -> 00.4 | I7: =C7/SUM(B7:C7) -> 00.6 | J7: =D7/SUM(D7:G7) -> 00.3 | K7: =E7/SUM(D7:G7) -> 0.5 | L7: =F7/SUM(D7:G7) -> 00.1 | M7: =G7/SUM(D7:G7) -> 00.1
A8: S6 | B8: 1 | C8: 9 | D8: 6 | E8: 2 | F8: 1 | G8: 1 | H8: =B8/SUM(B8:C8) -> 00.1 | I8: =C8/SUM(B8:C8) -> 00.9 | J8: =D8/SUM(D8:G8) -> 00.6 | K8: =E8/SUM(D8:G8) -> 00.2 | L8: =F8/SUM(D8:G8) -> 00.1 | M8: =G8/SUM(D8:G8) -> 00.1
A9: S7 | B9: 1 | C9: 9 | D9: 4 | E9: 5 | F9: 1 | G9: 0 | H9: =B9/SUM(B9:C9) -> 00.1 | I9: =C9/SUM(B9:C9) -> 00.9 | J9: =D9/SUM(D9:G9) -> 00.4 | K9: =E9/SUM(D9:G9) -> 0.5 | L9: =F9/SUM(D9:G9) -> 00.1 | M9: =G9/SUM(D9:G9) -> 0
A10: S8 | B10: 2 | C10: 8 | D10: 3 | E10: 4 | F10: 1 | G10: 2 | H10: =B10/SUM(B10:C10) -> 00.2 | I10: =C10/SUM(B10:C10) -> 00.8 | J10: =D10/SUM(D10:G10) -> 00.3 | K10: =E10/SUM(D10:G10) -> 00.4 | L10: =F10/SUM(D10:G10) -> 00.1 | M10: =G10/SUM(D10:G10) -> 00.2
A11: S9 | B11: 7 | C11: 3 | D11: 2 | E11: 3 | F11: 3 | G11: 2 | H11: =B11/SUM(B11:C11) -> 00.7 | I11: =C11/SUM(B11:C11) -> 00.3 | J11: =D11/SUM(D11:G11) -> 00.2 | K11: =E11/SUM(D11:G11) -> 00.3 | L11: =F11/SUM(D11:G11) -> 00.3 | M11: =G11/SUM(D11:G11) -> 00.2
A12: S10 | B12: 5 | C12: 5 | D12: 4 | E12: 2 | F12: 2 | G12: 2 | H12: =B12/SUM(B12:C12) -> 0.5 | I12: =C12/SUM(B12:C12) -> 0.5 | J12: =D12/SUM(D12:G12) -> 00.4 | K12: =E12/SUM(D12:G12) -> 00.2 | L12: =F12/SUM(D12:G12) -> 00.2 | M12: =G12/SUM(D12:G12) -> 00.2
A13: S11 | B13: 1 | C13: 9 | D13: 3 | E13: 5 | F13: 1 | G13: 1 | H13: =B13/SUM(B13:C13) -> 00.1 | I13: =C13/SUM(B13:C13) -> 00.9 | J13: =D13/SUM(D13:G13) -> 00.3 | K13: =E13/SUM(D13:G13) -> 0.5 | L13: =F13/SUM(D13:G13) -> 00.1 | M13: =G13/SUM(D13:G13) -> 00.1
A14: S12 | B14: 2 | C14: 8 | D14: 5 | E14: 2 | F14: 1 | G14: 2 | H14: =B14/SUM(B14:C14) -> 00.2 | I14: =C14/SUM(B14:C14) -> 00.8 | J14: =D14/SUM(D14:G14) -> 0.5 | K14: =E14/SUM(D14:G14) -> 00.2 | L14: =F14/SUM(D14:G14) -> 00.1 | M14: =G14/SUM(D14:G14) -> 00.2
A15: S13 | B15: 2 | C15: 8 | D15: 4 | E15: 2 | F15: 2 | G15: 2 | H15: =B15/SUM(B15:C15) -> 00.2 | I15: =C15/SUM(B15:C15) -> 00.8 | J15: =D15/SUM(D15:G15) -> 00.4 | K15: =E15/SUM(D15:G15) -> 00.2 | L15: =F15/SUM(D15:G15) -> 00.2 | M15: =G15/SUM(D15:G15) -> 00.2
A16: S14 | B16: 7 | C16: 3 | D16: 2 | E16: 8 | F16: 0 | G16: 0 | H16: =B16/SUM(B16:C16) -> 00.7 | I16: =C16/SUM(B16:C16) -> 00.3 | J16: =D16/SUM(D16:G16) -> 00.2 | K16: =E16/SUM(D16:G16) -> 00.8 | L16: =F16/SUM(D16:G16) -> 0 | M16: =G16/SUM(D16:G16) -> 0
A17: S14.1 | B17: 1 | C17: 9 | D17: 4 | E17: 3 | F17: 1 | G17: 2 | H17: =B17/SUM(B17:C17) -> 00.1 | I17: =C17/SUM(B17:C17) -> 00.9 | J17: =D17/SUM(D17:G17) -> 00.4 | K17: =E17/SUM(D17:G17) -> 00.3 | L17: =F17/SUM(D17:G17) -> 00.1 | M17: =G17/SUM(D17:G17) -> 00.2
A18: S14.2 | B18: 1 | C18: 9 | D18: 3 | E18: 3 | F18: 2 | G18: 2 | H18: =B18/SUM(B18:C18) -> 00.1 | I18: =C18/SUM(B18:C18) -> 00.9 | J18: =D18/SUM(D18:G18) -> 00.3 | K18: =E18/SUM(D18:G18) -> 00.3 | L18: =F18/SUM(D18:G18) -> 00.2 | M18: =G18/SUM(D18:G18) -> 00.2
A19: S14.3 | B19: 4 | C19: 6 | D19: 2 | E19: 3 | F19: 3 | G19: 2 | H19: =B19/SUM(B19:C19) -> 00.4 | I19: =C19/SUM(B19:C19) -> 00.6 | J19: =D19/SUM(D19:G19) -> 00.2 | K19: =E19/SUM(D19:G19) -> 00.3 | L19: =F19/SUM(D19:G19) -> 00.3 | M19: =G19/SUM(D19:G19) -> 00.2
A20: S15 | B20: 5 | C20: 5 | D20: 2 | E20: 1 | F20: 1 | G20: 6 | H20: =B20/SUM(B20:C20) -> 0.5 | I20: =C20/SUM(B20:C20) -> 0.5 | J20: =D20/SUM(D20:G20) -> 00.2 | K20: =E20/SUM(D20:G20) -> 00.1 | L20: =F20/SUM(D20:G20) -> 00.1 | M20: =G20/SUM(D20:G20) -> 00.6
A21: S16 | B21: 3 | C21: 7 | D21: 3 | E21: 7 | F21: 0 | G21: 0 | H21: =B21/SUM(B21:C21) -> 00.3 | I21: =C21/SUM(B21:C21) -> 00.7 | J21: =D21/SUM(D21:G21) -> 00.3 | K21: =E21/SUM(D21:G21) -> 00.7 | L21: =F21/SUM(D21:G21) -> 0 | M21: =G21/SUM(D21:G21) -> 0
A22: S16.1 | B22: 1 | C22: 9 | D22: 4 | E22: 4 | F22: 1 | G22: 1 | H22: =B22/SUM(B22:C22) -> 00.1 | I22: =C22/SUM(B22:C22) -> 00.9 | J22: =D22/SUM(D22:G22) -> 00.4 | K22: =E22/SUM(D22:G22) -> 00.4 | L22: =F22/SUM(D22:G22) -> 00.1 | M22: =G22/SUM(D22:G22) -> 00.1
A23: S16.2 | B23: 1 | C23: 9 | D23: 5 | E23: 4 | F23: 1 | G23: 0 | H23: =B23/SUM(B23:C23) -> 00.1 | I23: =C23/SUM(B23:C23) -> 00.9 | J23: =D23/SUM(D23:G23) -> 0.5 | K23: =E23/SUM(D23:G23) -> 00.4 | L23: =F23/SUM(D23:G23) -> 00.1 | M23: =G23/SUM(D23:G23) -> 0
A24: S16.3 | B24: 1 | C24: 9 | D24: 5 | E24: 4 | F24: 1 | G24: 0 | H24: =B24/SUM(B24:C24) -> 00.1 | I24: =C24/SUM(B24:C24) -> 00.9 | J24: =D24/SUM(D24:G24) -> 0.5 | K24: =E24/SUM(D24:G24) -> 00.4 | L24: =F24/SUM(D24:G24) -> 00.1 | M24: =G24/SUM(D24:G24) -> 0
A25: S16.4 | B25: 1 | C25: 9 | D25: 4 | E25: 4 | F25: 1 | G25: 1 | H25: =B25/SUM(B25:C25) -> 00.1 | I25: =C25/SUM(B25:C25) -> 00.9 | J25: =D25/SUM(D25:G25) -> 00.4 | K25: =E25/SUM(D25:G25) -> 00.4 | L25: =F25/SUM(D25:G25) -> 00.1 | M25: =G25/SUM(D25:G25) -> 00.1
A26: S17 | B26: 1 | C26: 9 | D26: 5 | E26: 3 | F26: 0 | G26: 2 | H26: =B26/SUM(B26:C26) -> 00.1 | I26: =C26/SUM(B26:C26) -> 00.9 | J26: =D26/SUM(D26:G26) -> 0.5 | K26: =E26/SUM(D26:G26) -> 00.3 | L26: =F26/SUM(D26:G26) -> 0 | M26: =G26/SUM(D26:G26) -> 00.2
A27: S18 | B27: 1 | C27: 9 | D27: 4 | E27: 3 | F27: 1 | G27: 2 | H27: =B27/SUM(B27:C27) -> 00.1 | I27: =C27/SUM(B27:C27) -> 00.9 | J27: =D27/SUM(D27:G27) -> 00.4 | K27: =E27/SUM(D27:G27) -> 00.3 | L27: =F27/SUM(D27:G27) -> 00.1 | M27: =G27/SUM(D27:G27) -> 00.2
A28: S19 | B28: 5 | C28: 5 | D28: 1 | E28: 1 | F28: 1 | G28: 7 | H28: =B28/SUM(B28:C28) -> 0.5 | I28: =C28/SUM(B28:C28) -> 0.5 | J28: =D28/SUM(D28:G28) -> 00.1 | K28: =E28/SUM(D28:G28) -> 00.1 | L28: =F28/SUM(D28:G28) -> 00.1 | M28: =G28/SUM(D28:G28) -> 00.7
A29: S19.1 | B29: 2 | C29: 8 | D29: 2 | E29: 3 | F29: 2 | G29: 3 | H29: =B29/SUM(B29:C29) -> 00.2 | I29: =C29/SUM(B29:C29) -> 00.8 | J29: =D29/SUM(D29:G29) -> 00.2 | K29: =E29/SUM(D29:G29) -> 00.3 | L29: =F29/SUM(D29:G29) -> 00.2 | M29: =G29/SUM(D29:G29) -> 00.3
A30: S19.2 | B30: 2 | C30: 8 | D30: 2 | E30: 4 | F30: 1 | G30: 3 | H30: =B30/SUM(B30:C30) -> 00.2 | I30: =C30/SUM(B30:C30) -> 00.8 | J30: =D30/SUM(D30:G30) -> 00.2 | K30: =E30/SUM(D30:G30) -> 00.4 | L30: =F30/SUM(D30:G30) -> 00.1 | M30: =G30/SUM(D30:G30) -> 00.3
A31: S19.3 | B31: 2 | C31: 8 | D31: 1 | E31: 3 | F31: 3 | G31: 3 | H31: =B31/SUM(B31:C31) -> 00.2 | I31: =C31/SUM(B31:C31) -> 00.8 | J31: =D31/SUM(D31:G31) -> 00.1 | K31: =E31/SUM(D31:G31) -> 00.3 | L31: =F31/SUM(D31:G31) -> 00.3 | M31: =G31/SUM(D31:G31) -> 00.3
A32: S19.4 | B32: 2 | C32: 8 | D32: 1 | E32: 3 | F32: 3 | G32: 3 | H32: =B32/SUM(B32:C32) -> 00.2 | I32: =C32/SUM(B32:C32) -> 00.8 | J32: =D32/SUM(D32:G32) -> 00.1 | K32: =E32/SUM(D32:G32) -> 00.3 | L32: =F32/SUM(D32:G32) -> 00.3 | M32: =G32/SUM(D32:G32) -> 00.3
A33: S19.5 | B33: 2 | C33: 8 | D33: 1 | E33: 3 | F33: 3 | G33: 3 | H33: =B33/SUM(B33:C33) -> 00.2 | I33: =C33/SUM(B33:C33) -> 00.8 | J33: =D33/SUM(D33:G33) -> 00.1 | K33: =E33/SUM(D33:G33) -> 00.3 | L33: =F33/SUM(D33:G33) -> 00.3 | M33: =G33/SUM(D33:G33) -> 00.3
A34: S19.6 | B34: 2 | C34: 8 | D34: 1 | E34: 4 | F34: 2 | G34: 3 | H34: =B34/SUM(B34:C34) -> 00.2 | I34: =C34/SUM(B34:C34) -> 00.8 | J34: =D34/SUM(D34:G34) -> 00.1 | K34: =E34/SUM(D34:G34) -> 00.4 | L34: =F34/SUM(D34:G34) -> 00.2 | M34: =G34/SUM(D34:G34) -> 00.3
A35: S19.7 | B35: 2 | C35: 8 | D35: 1 | E35: 4 | F35: 2 | G35: 3 | H35: =B35/SUM(B35:C35) -> 00.2 | I35: =C35/SUM(B35:C35) -> 00.8 | J35: =D35/SUM(D35:G35) -> 00.1 | K35: =E35/SUM(D35:G35) -> 00.4 | L35: =F35/SUM(D35:G35) -> 00.2 | M35: =G35/SUM(D35:G35) -> 00.3
A36: S19.8 | B36: 2 | C36: 8 | D36: 1 | E36: 4 | F36: 2 | G36: 3 | H36: =B36/SUM(B36:C36) -> 00.2 | I36: =C36/SUM(B36:C36) -> 00.8 | J36: =D36/SUM(D36:G36) -> 00.1 | K36: =E36/SUM(D36:G36) -> 00.4 | L36: =F36/SUM(D36:G36) -> 00.2 | M36: =G36/SUM(D36:G36) -> 00.3
A37: S20 | B37: 1 | C37: 9 | D37: 1 | E37: 5 | F37: 3 | G37: 1 | H37: =B37/SUM(B37:C37) -> 00.1 | I37: =C37/SUM(B37:C37) -> 00.9 | J37: =D37/SUM(D37:G37) -> 00.1 | K37: =E37/SUM(D37:G37) -> 0.5 | L37: =F37/SUM(D37:G37) -> 00.3 | M37: =G37/SUM(D37:G37) -> 00.1
A38: S21 | B38: 1 | C38: 9 | D38: 1 | E38: 6 | F38: 1 | G38: 2 | H38: =B38/SUM(B38:C38) -> 00.1 | I38: =C38/SUM(B38:C38) -> 00.9 | J38: =D38/SUM(D38:G38) -> 00.1 | K38: =E38/SUM(D38:G38) -> 00.6 | L38: =F38/SUM(D38:G38) -> 00.1 | M38: =G38/SUM(D38:G38) -> 00.2
A39: S22 | B39: 1 | C39: 9 | D39: 1 | E39: 4 | F39: 3 | G39: 2 | H39: =B39/SUM(B39:C39) -> 00.1 | I39: =C39/SUM(B39:C39) -> 00.9 | J39: =D39/SUM(D39:G39) -> 00.1 | K39: =E39/SUM(D39:G39) -> 00.4 | L39: =F39/SUM(D39:G39) -> 00.3 | M39: =G39/SUM(D39:G39) -> 00.2
A40: S23 | B40: 1 | C40: 9 | D40: 1 | E40: 5 | F40: 2 | G40: 2 | H40: =B40/SUM(B40:C40) -> 00.1 | I40: =C40/SUM(B40:C40) -> 00.9 | J40: =D40/SUM(D40:G40) -> 00.1 | K40: =E40/SUM(D40:G40) -> 0.5 | L40: =F40/SUM(D40:G40) -> 00.2 | M40: =G40/SUM(D40:G40) -> 00.2
A41: S24 | B41: 1 | C41: 9 | D41: 5 | E41: 3 | F41: 1 | G41: 1 | H41: =B41/SUM(B41:C41) -> 00.1 | I41: =C41/SUM(B41:C41) -> 00.9 | J41: =D41/SUM(D41:G41) -> 0.5 | K41: =E41/SUM(D41:G41) -> 00.3 | L41: =F41/SUM(D41:G41) -> 00.1 | M41: =G41/SUM(D41:G41) -> 00.1
A42: TOTAIS | B42: =SUM(B3:B41) -> 89 | C42: =SUM(C3:C41) -> 301 | D42: =SUM(D3:D41) -> 111 | E42: =SUM(E3:E41) -> 140 | F42: =SUM(F3:F41) -> 60 | G42: =SUM(G3:G41) -> 79